Title,Link,Description,Summary
"Tesla News, Tips, Rumors, and Reviews",https://www.teslarati.com/,"Tesla is building a new UFO-inspired Supercharger in the heart of Alien country · This Tesla vandal caused thousands in damage, but she was let off the hook: ...","This Tesla vandal caused thousands in damage, but she was let off the hook: Here's why · Tesla Model Y tops Norway sales despite low Q1 delivery results."
"Tesla News, Latest Software Updates, Tesla Rumors and Tips",https://www.notateslaapp.com/,Tesla Plans CyberCanopy Supercharger with RGB Lighting and UFO-Inspired Design · Imagining Tesla's Robotaxi Network Charging Stations · Tesla Announces 2025 Q1 ...,"The latest Tesla news, software updates, rumors and Tesla tips. Tesla software update release notes and so much more."
Tesla news - Today's latest updates,https://www.cbsnews.com/tag/tesla/,"Tesla · Tesla sales drop 13% from last year · Tesla decelerates as its vehicle shipments slid 13% in first quarter · Tesla EVs, charging stations targeted by ...","Tesla · Tesla sales drop 13% from last year · Tesla decelerates as its vehicle shipments slid 13% in first quarter · Tesla EVs, charging stations targeted by ..."
News,https://www.tesla.com/blog,"Model 3 has been awarded 5-stars with a Weighted Overall Index of 9.8/10 by Green NCAP, an independent initiative helping consumers evaluate vehicle ...","Read full articles, watch videos, browse thousands of titles and more on the ""Home page"" topic with Google News."
Tesla - BBC News,https://www.bbc.com/news/topics/c8nq32jwjnmt,Tesla sales plunge after Elon Musk backlash. The car maker's sales slide has been attributed to competition and controversy around its boss. 1 day ago. Business.,Tesla · Tesla sales plunge after Elon Musk backlash · Protesters target Musk in rallies outside showrooms · Chinese electric carmaker BYD sales beat Tesla.
The Latest Tesla News and Updates,https://www.motortrend.com/auto-news/tesla/,Interested in Tesla news? Get the latest Tesla news and info from across the auto industry now on MotorTrend.,"The latest Tesla news, software updates, rumors and Tesla tips. Tesla software update release notes and so much more."
Latest Tesla News,https://www.teslarati.com/latest-tesla-news/,"Latest Tesla News · Tesla is building a new UFO-inspired Supercharger in the heart of Alien country · This Tesla vandal caused thousands in damage, but she was let off the hook: Here's why · Tesla Model Y tops Norway sales despite low Q1 delivery results · Elon Musk will continue as DOGE adviser: VP Vance.","Tesla is building a new UFO-inspired Supercharger in the heart of Alien country · This Tesla vandal caused thousands in damage, but she was let off the hook: ..."
